id	label	result_type	name	category	description	method_type	input	output	next_node	next_yes	next_no	guidance	comments
A0001	OP001_01	text	Problem Formulation	OPERATOR	Enter the problem formulation by defining the purpose and scope of the hazard/risk assessment and listing the relevant regulations, where applicable.	Define the purpose and scope of the hazard/risk assessment and the required granularity of the analysis. List the relevant regulation(s) that must be considered in case the assessment is intended for regulatory purposes. Also include the substance definition, the envisaged exposure scenario(s), and the target population(s). Specify the areas of toxicity of concern (knowledge gap to be filled), and give an indication of the level of uncertainty that is considered acceptable. If possible/applicable: specify the level of need for mechanistic understanding and potential exit points (when is information considered sufficient).		Clear description of the (regulatory) questions that need to be addressed, the regulations that apply, the main route(s) of exposure, and the target population(s) as well as the data gap to be filled.	A0002				
A0002	BB002_01	text	Relevant existing data for substance of interest?	TASK	Search for available physicochemical, toxicological, toxicokinetic and mechanistic data about the substance of interest as well as data on exposure levels relevant for the target population.	Search for available physicochemical, toxicological, toxicokinetic and mechanistic data about the substance of interest in existing data sources. Compile all available data on exposure levels that are relevant for the target population (as defined in the problem formulation). Carefully review the quality of all data collected. Provide a transparent information overview of the data collected.			A0003				
A0003	DP01EF_01	bool	Information sufficient?	LOGICAL	Justify if the data collected is sufficient for addressing the questions posed in the problem formulation. If information is considered sufficient (Yes), record the basis for this decision and continue to OP003. If information is considered insufficient, specify the knowledge gaps and/or remaining uncertainties and continue to DP26EF.	Document (1) the criteria that have been considered for the decision; (2) the data that have been used; (3) effect thresholds that are considered relevant given the problem formulation; (4) thresholds of certainty required for the data used; (5) discussion points and possibly consistency checks that were important for the decision.				A0004	A0006		
A0004	OP003_01	text	Derive Point-of-Departure 	OPERATOR	Compile all data from assays considered to be predictive of hazard, determine concentration dependency of the effect for each assay, and determine, preferably using benchmark concentration (BMC) analysis, the minimum concentration at which hazard may be triggered. Compile all BMCs and determine which of them is considered most relevant. This one is termed point of departure (PoD). Decide (and justify) whether a single PoD or multiple PoDs are applicable.	Compile all data from assays considered to be predictive of hazard and determine for each assay the concentration dependency of the effect measured. Fit a function through the data points, preferably using benchmark concentration analysis, and determine the minimum concentration (BMC or BMCL) at which hazard may be triggered. Carefully consider the benchmark response (critical effect size) to be used. Give a rationale why and how the BMC(L) was chosen. Compile all BMCs and determine which of them is considered most relevant. This one is termed point of departure (PoD). Give a rationale for the choice made and indicate the uncertainty of the decision. Decide and justify whether a single PoD or multiple PoDs were chosen. In the latter case decide and justify whether the multiple PoDs are collapsed to a a single value (+/- variance), or whether work is continued with a distribution function of PoD.			A0005				
A0005	REPORT_01	text	Report	END	Create a report of the assessment. Where applicable, integrate results with other assessments.	Create a report of the assessment in line with the requirements of the relevant regulations.				 	 	EFSA Guidance on the use of TTC in food safety assessment: https://doi.org/10.2903/j.efsa.2019.5708	
A0006	DP26EF_01	bool	Is TTC applicable?	LOGICAL	Determine whether the TTC (Threshold of Toxicological Concern) can be applied.	The TTC approach can be used when the chemical structure of the substance is known, there are limited chemical?specific toxicity data and the exposure can be estimated. Determine whether the substance of interest belongs to any of the exclusion categories.				A0007	A0010		
A0007	BB035_01	text	Perform TTC approach	TASK	Perform the TTC approach conform the TTC decision tree and appropriate guidance and apply the relevant TTC value.	Estimate the exposure for the substance of interest, determine whether the substance of interest has the potential to be a DNA?reactive mutagens and/or carcinogen, or an organophosphate or carbamate. If not, group the substance according to the Cramer classification. Apply the respective TTC value. 			A0008	 	 		
A0008	DP27EF_01	bool	Is exposure estimate < TTC?	LOGICAL	Determine whether the estimated exposure for the substance of interest is below the relevant TTC value.	Compare the exposure estimate with the relevant TTC value and detemine whether the exposure is below the TTC value.				A0009	A0010		
A0009	REPORT_04	text	Report	END	Create a report of the assessment. Where applicable, integrate results with other assessments.	Create a report of the assessment in line with the requirements of the relevant regulations.				 	 		
A0010	DP02EF_01	bool	Is read-across applicable?	LOGICAL	Consider using read-across for addressing the regulatory question(s) at hand. Justify how the application of read-across can address the question(s) posed in the problem formulation.  	(1) Document the pre acceptance criteria for the substances that have been considered for the decision; (2) Define the appropriate scenario for the read across analogue or category; (3) Describe the data that have been used; (4) Define effect thresholds considered relevant; (5) Define thresholds of certainty required for data used; (6) Describe discussion points and possibly consistency checks that have been important for the decision.				A0011	A0014	Make use of ECHA's Read Across Assessment Framework (RAAF) to check the robustness of your read-across adaptation: https://echa.europa.eu/documents/10162/13628/raaf_en.pdf/614e5d61-891d-4154-8a47-87efebd1851a	
A0011	WF01_01		Perform dedicated workflow for (NAM-based) read-across 	MODULE	Perform the read-across assessment, using appropriate substances as source.	Assess biological similarity using NAMs, e.g. as described in Escher et al. 2022 (10.1016/j.tiv.2021.105269)			A0012	 	 		
A0012	DP03EF_01 	bool	Information sufficient?	LOGICAL	Does the read-across assessment provide sufficient information to address the regulatory question(s) with a sufficient level of certainty?	Carefully review the robustness of the read-across assessment, including gaps and inconsistencies. Determine whether the level of uncertainty obtained is considered acceptable for the problem formulation at hand.				A0004	A0013		
A0013	OP004_01	text	Identify data gap and define testing strategy based on problem formulation	OPERATOR	Consider whether the regulatory question(s) at hand can be addressed using NAMs. If so, outline necessary steps for hazard, ADME and exposure, where appropriate.  	Carefully consider the problem formulation. Consider if and how NAM-based information and/or data can fill data gaps. Select relevant NAMs for the data gaps to be filled and, where applicable, define the order or priorities in data generation.			A0014	 	 		
A0014	BB030_01	text	Characterise the substance for selecting appropriate NAMs	TASK	Characterise the phyisco-chemical properties of the substance of interest to define which NAMs are appropriate for testing.	Characterise the phyisco-chemical properties of the test substance to select appropriate NAMs. Collect info for and/or test for properties that impact on the selection of NAMs, such as stability of the substance in medium, its binding to plastic, volatility of the substance, water solubility, pKa, corrosiveness, etc.			A0015	 	 		
A0015	DP04EF_01	bool	Is NAM -based testing feasible for the substance of interest	LOGICAL	"Evaluate if the substance of interest has physico-chemical or other properties, which would interfere with its testing in NAMs proposed in OP004 
"	Document (1) the criteria that have been considered for the decision; (2) the data that have been used.		Define experimental conditions based on substance properties		H0001,B0001,E0001	 E0001,A0016		
A0016	REPORT_02	text	Report	END	Create a report of the assessment. Where applicable, integrate results with other assessments.					 			
H0001	BB010_01	text	Generate toxicologically-relevant in silico predictions of hazard	TASK	(1) Use QSAR models (and other available computational methods) for predictions of relevant bioactivity (e.g. toxicological targets), of toxicological endpoints (e.g. genotoxicity) or of events that may be associated to AOP (MIE, KE, AO). (2) Document the model, its prediction, the strength of predicition (or uncertainty), if possible the potency range, and performance parameters of the model.	Use the query compound as input for a panel of computational models (e.g. collected at DTU). Ideally use multiple panels/tools.  The reason for using these panels tools should be justified, based on relevance for the problem formulation and an ability to determine the confidence in the model and thus its applicability for the compound of interest. Such panels of models could include Danish QSAR database, OECD toolbox, as opensource systems, Vegahub as well as commecrical options. Use of multiple models may strengthen the weight of evidence or quality of the prediction. If using multiple models for an endpoint define upfront how these will be combined and interpreted. eg consensus, majority etc.	 (AW - input for guidance - that can be extended by Eva and team) Results from the model(s) predictions(s)l should align to the base requirements as laid out by the OCED Model prediction reporting template https://one.oecd.org/document/ENV/CBC/MONO(2023)32/ANN2/en/pdf.  Key considerations should include relevant information that supports or justifies the interpretation of the result.  Whether it is categorical active/ in active and inform on how the uncertainty related to the model prediction is defined, - is it quantitative or qualitative, whether the alert is present/ how often/ is the compound within the applicability domain. Final output should summarise findings -justify why findings maybe disgarded due to low confidence and the keys findings that will be addressed and/or followed up in subsequent NAMs relevant to the endpoint defined for the problem formulation. Large data sets may be generated (hundreds or thousands of models). They are difficult to interpret as such. Iterpretation becomes more robust, if additional generation is provided on model reliability, or applicability domain and on overlap of results from different models. Some models may also provide more explanatory output. All such informaton is beneficial for ranking and next steps. A transparent display is important/mandatory; naked excel files with loads of abbreviations are of little use.	Input for target interaction are only the query compound properties/structure. For RAx, source compounds are an additional input, together with a solid rationale why these source compounds have been selected.	H0002	 	 	BB011	
H0002	OP050_01	text	"Review for alerts for 
specific endpoints "	OPERATOR	Check whether there is information (relevant and significant) that indicates a potential of the test chemical to trigger certain specific toxicological endpoints that are not at the core of the ASPA workflow (e.g. skin sensitization, genotoxicity, topical toxicity). Judge this information (weight-of-evidence) and come to a decision for one or more of the specific endpoints.	"(1) Consider for this DP, what is relevant in the context of the problem formulation. If there is an alert for skin irritation, but this is not relevant for the problem formulation, then the answer should be ""No"".
Genotoxicity alerts can take a special role, as they may lead to a termination of the ASPA, and to a change of information requirements. 
(2) Evaluate the strength of the alert (in most cases based on QSAR models, possibly also based on experimental gene expression data, or based on legacy data). Decide on whether the alert is significant enough to enter specific downstream modules for confirmation."	Document the (1) criteria that have been considered for the decision; (2) data that have been used; (3) effect thresholds considered relevant; (4) thresholds of certainty required for data used; (5) discussion points and possibly consistency checks that have been important for the decision. With evolution of NAMASTOX, increasing levels of guidance on above points will be incorporated in this decision point.		H0005,H0003		  	REPORT_03	
H0003	WF03_01		Module for specific endpoints like acute topical toxicity or genotoxicity	MODULE	Perform relevant Defined Approaches based and/or dedicated tests to confirm or characterize alert(s)	To be defined in detail later, as it refers to an entire set of modules which are not in the core ASPA workflow	There are OECD-recognized NAM-based approaches that may be used. The focus of ASPA is presently not on these toxicity endpoints		H0004		 	n.a.	ML: This box is strange. It should rather be a transfer box to final reporting. The final report would then state that a full risk assessment was not performed because compound was considered genotoxic and thus outside the applicability range of the ASPA version
H0004	REPORT_03		Report on specific toxicity endpoints 	END	Create report e.g. of the genotoxicity assessment		In case of genotoxic hazard, consider to exit the ASPA workflow.				 	OP051	AWfor column F: Currently doesn't meet suggested parameters and could reduce to perform a relevant bioacivity screen using high throughput assays that can be justified as addressing the problem formulation and/or supplementing the findings from the in silico screen. Can be performed at either AOP level or at a broader endpoint level.  Rest of information from These assays .... should be shifted to either guidance or proposed approach.
H0005	BB011_02	text	Identify bioactivity	TASK	"(1) Use an assembly of assays with a broad biological coverage. Ideally, all potential bioactivities that may lead to adverse reactions should be captured.
(2) The concentration range of the assays should be chosen and account for the potential exposure scenario as well as solubility or cytotoxicity limits with a clear justification related to the problem formulation for the top concentration chosen and range used. 
(3) The compound under consideration should fit within the defined applicability domains of the assays utilised. 
(4) Testing involves also the data processing and data interpretation procedure associated with the respective assays (e.g. deriving a PoD and determining uncertainty)."	"Perform the required number of biological and technical replicates and different concentrations as described in the assay specification (e.g. ToxTemp). Determine concentration ranges with no effect, potentially specific effects, and of general cytotoxicity. Document the outputs from the assays providing overall result classification, quantitative values an evaluation of data quality as well as variability, such as standard deviation or BMDL and uncertainty considerations. For concentration-response data, provide graphs within the reports for each assay.
Include the data interpretation method for 1) how a quantitative POD analysis has been performed or 2) how a positive/negative classification has been defined as well as the software used.  Incorporate reasoning for use of software, and version and how the POD relates to the activity for example AC50/AC20 values BMD/ BMDL value.
Assay requirements are as follows. Assays can be from commercial or other sources, but they all should be highly reliable and transparently descibed (including a clear  standard operating procedure). All test compound data must be accompanied by suitable  positive and negative control data. The assay performance needs to be documented; assay readiness status depends on the problem formulation, but need to be indicated in all cases.
Example for such assays (RH3R version of ASPA) are stress reporter assays including ToxTracker, Calux receptor binding assays, cytotoxicity assays in 3 cell lines (proliferating HepG2, LUHMES, RPTEC), and a Tempo-SEQ HTTr assays in PHH cells and RPTEC. "	Use data-driven approach or AOP-based approach. Both options should be incorporated  (AW extension of guidance)  Define and justify the set of assays used at this stage and why they are relevant to cover the key endpoint(s) related to the defined problem formulation and the requirement for this task stage eg - Mode of action determination, AOp supporting evidence, Protection goal.  Supporting evidence should be provided to indicate why these assays are sufficient in coverage/relevance and examples include - a) assays relate to positive findings and associated AOPs indentified from in silico predictions for hazard characterisation.  Assays have met and are performed at a technical readiness level that is sufficient to provide confidence in the determined end result whether this is qualitative or quantifiable. Additional considerations should include dose range performed - in vitro assays cover the expected exposure predicted from PBPK, range extends up to solubility limits, cytotox limits or 500uM/ 100x cMax and that these are greater than expected internal exposure.   Metabolism has been accounted for within the assays based on predictions frm ADME pillar. For those that are grouped within a 		H0006		 	OP013	
H0006	OP051_01	text	"Review for alerts for 
specific endpoints "	OPERATOR	Check whether there is information (relevant and significant) that indicates a potential of the test chemical to trigger certain specific toxicological endpoints that are not at the core of the ASPA workflow (e.g. skin sensitization, genotoxicity, topical toxicity). Judge this information (weight-of-evidence) and come to a decision for one or more of the specific endpoints.	"(1) Consider for this DP, what is relevant in the context of the problem formulation. If there is an alert for skin irritation, but this is not relevant for the problem formulation, then the answer should be ""No"".
Genotoxicity alerts can take a special role, as they may lead to a termination of the ASPA, and to a change of information requirements. 
(2) Evaluate the strength of the alert (in most cases based on QSAR models, possibly also based on experimental gene expression data, or based on legacy data). Decide on whether the alert is significant enough to enter specific downstream modules for confirmation."	Document the (1) criteria that have been considered for the decision; (2) data that have been used; (3) effect thresholds considered relevant; (4) thresholds of certainty required for data used; (5) discussion points and possibly consistency checks that have been important for the decision. With evolution of NAMASTOX, increasing levels of guidance on above points will be incorporated in this decision point.		H0007,H0003		 	DP10	previous info This task is complex and will be refined with time. It is also likely that this tasks is part of an optimisatin cycle during which more and more information is gathered until the integration of it leads to conclusion suseful for further steps in teh ASPA and for risk assessment. Several steps/levels may be envisaged. Some are necessary, additional ones may be included: (1) determine the highest non-bioactive (or non-hazardous, if possible) concentration. (2) determine the highest non-cytotoxic concentration. (3) Determine whether the compounds target(s) are known. (4) Determine whether the compound is likely to activate certain AOP. (5) Provide an estimate on whether potential hazardous effects have been identified with sufficient sensitivity (low FN rate). (6) Identify gaps of information to come to clear solutions. (7) Suggest information gaps to be filled by low-throughput, detailed testing.
H0007	OP013_01	text	Integration of initial hazard/bioactivity data & derive Point-of-Departure (POD) estimate	OPERATOR	"Integrate the in silico and in vitro predictions. Analyze and integrate the results obtained in previous steps. Derive estimates of Point-of-Departure (POD). 
"	"Combine and integrate the weight of evidence across both in silico and in vitro data to assess for hazard identification and/or highest concentration where no bioactivity could be determined across the selected assays. In assessing the weight of evidence document how the data has been combined and whether the data is in concordance or has conflicting evidence relevant modes of action (for toxicity). Document discounted assays due to quality or high cytotoxicity

Determine whether the compound can be defined as specific acting
(1) Determine whether defined molecular target(s) (MIEs) can be identified at doses below cytotoxicity and if these can be linked to documented AOPs within AOP wiki
(2) Show that these are primary drivers for decision by being lowest POD and no other effects are observed within the same dose range
Alternatively determine the minimum bioactivity POD that can be determined
(3) determine the highest non-bioactive (or non-hazardous, if possible) concentration. 
(4) determine the highest non-cytotoxic concentration. 
(5) Provide an estimate on whether potential hazardous effects have been identified with sufficient sensitivity (low FN rate). The scientific robustness of the individual assay that for the group such as their readiness criteria.
(6) Provide Justification of the overall performance to the grouping of tools used to inform on low probability of adverse effects below determined POD concentration. Justification can be defined based on a theoretical scientific justification or from a data driven approach and should account for the chemical space of the compound being tested.
(7) Identify gaps or uncertainties remaining in information requirements for example metabolic capacity insufficient/ transporter effects cannot be explained assays don’t cover predicted or known targets. 
(8) Suggest whether information gaps need to be addressed and how by low-throughput, further additional assays to refine these eg: an assay for AChE activity, a MEA assay (ion channels, electrical activities) and assays that capture metabolic activation or specific transporters of the kidney."			H0008		 	No: BB025; Yes: BB015	
H0008	DP10EF_01	bool	Refinement of POD needed, given problem formulation?	LOGICAL	Consider whether the confidence in the POD estimates is sufficient for the problem formulation at hand. Determine if the data obtained and generated combined provides sufficient scientific justification to support a clear Mode of action and whether this is associated with known AOP(s). Consider if the data generated enables a decision to be reached based on a protective estimate of bioactivty POD and covers sufficient biolgical coverage for the endpoint(s) relevant for the probelm formulation.	Document the (1) criteria that have been considered for the decision; (2) data that have been used; (3) effect thresholds considered relevant; (4) thresholds of certainty required for data used; (5) discussion points and possibly consistency checks that have been important for the decision. With evolution of NAMASTOX, increasing levels of guidance on above points will be incorporated in this decision point.	If the confidence is insufficient, perform additional testing. In case of sufficient confidence in negative results, no further testing is needed. 			H0009	X0001	OP017	
H0009	BB015_01	text	Generate in vitro toxicity data for more (complex) NAMs	TASK	This is a box that stands for a complex subroutine. The choice of NAM and the type of subroutine depends on the problem formulaton and the data generated in more upstream parts. For some narrowly defined problem formulations, more defined subroutines can be constructed. For instance, if the problem forumulation is about DNT, then this subroutine would include testing in teh DNT-IVB, as defined by teh OECD (GD377). If the problem formulation asks about clarification of potential renal toxicity, then models of respective cell types with overexpression of relevant transporters may be used, in combination with organoid approaches or organ-on-a-chip setups that connect e.g. kidney and liver tissues.				H0010		 	DP12	
H0010	OP017_01	text	Integration of tier 2 data & Derive refined Point-of-Departure (POD)	OPERATOR	Integrate the results from more (complex) in vitro tests (BB015).				H0011		 	No: BB045; Yes: BB025	
H0011	DP12EF_01	bool	"
POD sufficiently refined?
Confidence in POD increased?"	OPERATOR	Did the results obtained from more complex in vitro tests result in sufficient refinement of the POD and its associated level of uncertainty?	Document the (1) criteria that have been considered for the decision; (2) data that have been used; (3) effect thresholds considered relevant; (4) thresholds of certainty required for data used; (5) discussion points and possibly consistency checks that have been important for the decision. With evolution of NAMASTOX, increasing levels of guidance on above points will be incorporated in this decision point.				X0001	H0012	OP030	
